{
  "$schema": "https://json-schema.org/draft/2020-12/schema",
  "$id": "https://vsn.internal/schemas/vsn-model-verification-evidence.schema.json",
  "title": "VSNModelVerificationEvidence",
  "description": "Content-safe evidence-reference bundle that binds dataset provenance, leakage, regression, benchmark, security, rollback and artifact-integrity review records to one exact VSN model artifact. Evidence references are opaque identifiers only; this contract does not authorize training, deployment or routing activation.",
  "type": "object",
  "additionalProperties": false,
  "required": [
    "schema_version",
    "evidence_id",
    "model_id",
    "model_version",
    "artifact_id",
    "artifact_sha256",
    "dataset_registry_refs",
    "evidence_refs"
  ],
  "properties": {
    "schema_version": {"const": 1},
    "evidence_id": {
      "type": "string",
      "pattern": "^MODELEVID-[A-Z0-9][A-Z0-9._-]{0,63}$"
    },
    "model_id": {
      "type": "string",
      "pattern": "^vsn-[a-z0-9][a-z0-9._-]{0,62}$"
    },
    "model_version": {
      "type": "string",
      "pattern": "^(0|[1-9][0-9]*)\\.(0|[1-9][0-9]*)\\.(0|[1-9][0-9]*)(?:-[0-9A-Za-z.-]{1,32})?$"
    },
    "artifact_id": {
      "type": "string",
      "pattern": "^MODELART-[A-Z0-9][A-Z0-9._-]{0,63}$"
    },
    "artifact_sha256": {
      "type": "string",
      "pattern": "^[a-f0-9]{64}$",
      "not": {"const": "0000000000000000000000000000000000000000000000000000000000000000"}
    },
    "dataset_registry_refs": {
      "type": "array",
      "minItems": 1,
      "maxItems": 64,
      "uniqueItems": true,
      "items": {
        "type": "string",
        "pattern": "^DATASET-[A-Z0-9][A-Z0-9._-]{0,63}$"
      }
    },
    "evidence_refs": {
      "type": "object",
      "additionalProperties": false,
      "required": [
        "dataset_provenance",
        "leakage_test",
        "model_regression",
        "benchmark",
        "security_review",
        "rollback",
        "artifact_integrity"
      ],
      "properties": {
        "dataset_provenance": {
          "type": "array",
          "minItems": 1,
          "maxItems": 64,
          "uniqueItems": true,
          "items": {
            "type": "string",
            "pattern": "^EVIDENCE-[A-Z0-9][A-Z0-9._-]{0,95}$"
          }
        },
        "leakage_test": {
          "type": "string",
          "pattern": "^EVIDENCE-[A-Z0-9][A-Z0-9._-]{0,95}$"
        },
        "model_regression": {
          "type": "string",
          "pattern": "^EVIDENCE-[A-Z0-9][A-Z0-9._-]{0,95}$"
        },
        "benchmark": {
          "type": "string",
          "pattern": "^EVIDENCE-[A-Z0-9][A-Z0-9._-]{0,95}$"
        },
        "security_review": {
          "type": "string",
          "pattern": "^EVIDENCE-[A-Z0-9][A-Z0-9._-]{0,95}$"
        },
        "rollback": {
          "type": "string",
          "pattern": "^EVIDENCE-[A-Z0-9][A-Z0-9._-]{0,95}$"
        },
        "artifact_integrity": {
          "type": "string",
          "pattern": "^EVIDENCE-[A-Z0-9][A-Z0-9._-]{0,95}$"
        }
      }
    }
  }
}
